<?xml version="1.0" encoding="UTF-8"?>
<product xmlns:xsi="http://www.w3.org/2001/XMLSchema-instance" xsi:schemaLocation="Myproduct product.xsd" xmlns="Myproduct" id="1" company="DEF Products Ltd.">
       <pname>Shampoo</pname>
       <price>123</price>
       <mfgdate>1999-02-03</mfgdate>
       <mfgtime>15:03:45</mfgtime>
       <discount>true</discount>
       <drate>10.25</drate>
       <pcode>INA45412</pcode>
</product>